{
  "metadata": {
    "source_file": "example_simple.json",
    "scale": "1/4\" = 1'-0\"",
    "units": "feet",
    "overall_width_ft": 30.0,
    "overall_depth_ft": 20.0,
    "floor_to_ceiling_ft": 9.0,
    "notes": []
  },
  "walls": [
    {"id": "W1", "start": {"x": 0, "y": 0}, "end": {"x": 30, "y": 0}, "thickness_in": 6, "type": "exterior"},
    {"id": "W2", "start": {"x": 30, "y": 0}, "end": {"x": 30, "y": 20}, "thickness_in": 6, "type": "exterior"},
    {"id": "W3", "start": {"x": 30, "y": 20}, "end": {"x": 0, "y": 20}, "thickness_in": 6, "type": "exterior"},
    {"id": "W4", "start": {"x": 0, "y": 20}, "end": {"x": 0, "y": 0}, "thickness_in": 6, "type": "exterior"},
    {"id": "W5", "start": {"x": 15, "y": 0}, "end": {"x": 15, "y": 20}, "thickness_in": 4, "type": "interior"}
  ],
  "doors": [
    {"id": "D1", "wall_id": "W1", "offset_ft": 5.0, "width_ft": 3.0, "swing": "left", "swing_side": "positive"},
    {"id": "D2", "wall_id": "W5", "offset_ft": 8.0, "width_ft": 3.0, "swing": "right", "swing_side": "negative"}
  ],
  "windows": [
    {"id": "WIN1", "wall_id": "W1", "offset_ft": 20.0, "width_ft": 4.0},
    {"id": "WIN2", "wall_id": "W2", "offset_ft": 8.0, "width_ft": 5.0},
    {"id": "WIN3", "wall_id": "W3", "offset_ft": 10.0, "width_ft": 6.0}
  ],
  "rooms": [
    {"name": "Living Room", "label_position": {"x": 7.5, "y": 10.0}, "dimensions": "15'-0\" x 20'-0\""},
    {"name": "Bedroom", "label_position": {"x": 22.5, "y": 10.0}, "dimensions": "15'-0\" x 20'-0\""}
  ],
  "dimensions": [
    {"start": {"x": 0, "y": 0}, "end": {"x": 30, "y": 0}, "text": "30'-0\"", "offset_ft": -2.0},
    {"start": {"x": 30, "y": 0}, "end": {"x": 30, "y": 20}, "text": "20'-0\"", "offset_ft": -2.0}
  ]
}
